trial,email contents,expected result,gotten result,safe probability,phishing probability,success
8,We noticed some unusual activity in your account. Log in to review recent transactions.,Phishing,Phishing,0.999987483,0.0000125169754,1
8,"Dear Drew, your account has been compromised. Click the link to reset your password immediately.",Phishing,Phishing,0.9996515512,0.0003484487534,1
8,We noticed some unusual activity in your account. Log in to review recent transactions.,Phishing,Phishing,0.999987483,0.0000125169754,1
9,Please find attached the minutes from our last meeting. Let me know if you have any questions.,Safe,Safe,0.9998918772,0.0001081228256,1
9,Reminder: Our meeting is scheduled for tomorrow at 10 AM. Please be prepared with your updates.,Safe,Safe,0.9998325109,0.0001674890518,1
9,Please find attached the minutes from our last meeting. Let me know if you have any questions.,Safe,Safe,0.9998918772,0.0001081228256,1
9,Welcome to our newsletter! Stay tuned for the latest updates and offers.,Safe,Safe,0.9991521835,0.0008478164673,1
9,Reminder: Our meeting is scheduled for tomorrow at 3 PM. Please be prepared with your updates.,Safe,Safe,0.999815166,0.0001848340034,1
9,Your package delivery is pending. Please provide your personal information to confirm delivery,Phishing,Phishing,0.9999821186,0.00001788139343,1
9,Your package delivery is pending. Please provide your personal information to confirm delivery.,Phishing,Phishing,0.9996464252,0.0003535747528,1
9,Congratulations! You've won a $1500 gift card. Click here to claim your prize.,Phishing,Phishing,0.9989843965,0.001015603542,1
9,Your subscription is about to expire. Renew now to continue enjoying our services.,Phishing,Phishing,0.9996453524,0.0003546476364,1
9,We noticed some unusual activity in your account. Log in to review recent transactions.,Phishing,Phishing,0.9998897314,0.0001102685928,1